{
  "name": "obsidian",
  "author": "Nous Land",
  "version": "1.0.0",
  "colors": {
    "bg": "#0d1117",
    "bg_alt": "#161b22",
    "bg_highlight": "#21262d",
    "fg": "#c9d1d9",
    "fg_alt": "#8b949e",
    "fg_dim": "#484f58",
    "accent": "#58a6ff",
    "accent_alt": "#79c0ff",
    "urgent": "#f85149",
    "success": "#3fb950",
    "warning": "#d29922",
    "border": "#30363d",
    "shadow": "#000000"
  },
  "surface": {
    "panel_bg": "#0d1117",
    "panel_fg": "#c9d1d9",
    "panel_border": "#30363d",
    "launcher_bg": "#0d1117",
    "launcher_fg": "#c9d1d9",
    "launcher_sel_bg": "#58a6ff",
    "launcher_sel_fg": "#0d1117",
    "notification_bg": "#161b22",
    "notification_fg": "#c9d1d9",
    "notification_border": "#58a6ff"
  },
  "typography": {
    "font_mono": "JetBrainsMono Nerd Font",
    "font_ui": "JetBrainsMono Nerd Font",
    "font_size": 11,
    "font_size_ui": 9
  },
  "wallpaper": {
    "path": "wallpaper.png",
    "mode": "fill"
  },
  "hyprland": {
    "border_width": 2,
    "active_border": "58a6ff",
    "inactive_border": "30363d",
    "gaps_inner": 4,
    "gaps_outer": 6,
    "rounding": 6,
    "dim_strength": 0.25,
    "shadow_range": 15,
    "shadow_render_power": 3
  },
  "kitty": {
    "foreground": "#c9d1d9",
    "background": "#0d1117",
    "selection_foreground": "#0d1117",
    "selection_background": "#58a6ff",
    "cursor": "#58a6ff",
    "cursor_text_color": "#0d1117",
    "url_color": "#79c0ff",
    "active_border_color": "#58a6ff",
    "inactive_border_color": "#30363d",
    "active_tab_background": "#58a6ff",
    "active_tab_foreground": "#0d1117",
    "inactive_tab_background": "#161b22",
    "inactive_tab_foreground": "#484f58",
    "color0": "#0d1117",
    "color1": "#f85149",
    "color2": "#3fb950",
    "color3": "#d29922",
    "color4": "#58a6ff",
    "color5": "#bc8cff",
    "color6": "#39c5cf",
    "color7": "#c9d1d9",
    "color8": "#484f58",
    "color9": "#ff7b72",
    "color10": "#56d364",
    "color11": "#e3b341",
    "color12": "#79c0ff",
    "color13": "#d2a8ff",
    "color14": "#56d4dd",
    "color15": "#f0f6fc"
  }
}
