{
  "name": "solace",
  "author": "Nous Land",
  "version": "1.0.0",
  "colors": {
    "bg": "#1a1613",
    "bg_alt": "#24201c",
    "bg_highlight": "#2e2a25",
    "fg": "#d5c4a1",
    "fg_alt": "#a89984",
    "fg_dim": "#7c6f64",
    "accent": "#d65d0e",
    "accent_alt": "#fe8019",
    "urgent": "#cc241d",
    "success": "#98971a",
    "warning": "#d79921",
    "border": "#3c3836",
    "shadow": "#000000"
  },
  "surface": {
    "panel_bg": "#1a1613",
    "panel_fg": "#d5c4a1",
    "panel_border": "#3c3836",
    "launcher_bg": "#1a1613",
    "launcher_fg": "#d5c4a1",
    "launcher_sel_bg": "#d65d0e",
    "launcher_sel_fg": "#1a1613",
    "notification_bg": "#24201c",
    "notification_fg": "#d5c4a1",
    "notification_border": "#d65d0e"
  },
  "typography": {
    "font_mono": "JetBrainsMono Nerd Font",
    "font_ui": "JetBrainsMono Nerd Font",
    "font_size": 11,
    "font_size_ui": 9
  },
  "wallpaper": {
    "path": "wallpaper.png",
    "mode": "fill"
  },
  "hyprland": {
    "border_width": 2,
    "active_border": "d65d0e",
    "inactive_border": "3c3836",
    "gaps_inner": 8,
    "gaps_outer": 10,
    "rounding": 12,
    "dim_strength": 0.2,
    "shadow_range": 12,
    "shadow_render_power": 2
  },
  "kitty": {
    "foreground": "#d5c4a1",
    "background": "#1a1613",
    "selection_foreground": "#1a1613",
    "selection_background": "#d65d0e",
    "cursor": "#d65d0e",
    "cursor_text_color": "#1a1613",
    "url_color": "#fe8019",
    "active_border_color": "#d65d0e",
    "inactive_border_color": "#3c3836",
    "active_tab_background": "#d65d0e",
    "active_tab_foreground": "#1a1613",
    "inactive_tab_background": "#24201c",
    "inactive_tab_foreground": "#7c6f64",
    "color0": "#1a1613",
    "color1": "#cc241d",
    "color2": "#98971a",
    "color3": "#d79921",
    "color4": "#458588",
    "color5": "#b16286",
    "color6": "#689d6a",
    "color7": "#d5c4a1",
    "color8": "#7c6f64",
    "color9": "#fb4934",
    "color10": "#b8bb26",
    "color11": "#fabd2f",
    "color12": "#83a598",
    "color13": "#d3869b",
    "color14": "#8ec07c",
    "color15": "#fbf1c7"
  }
}
