{
  "name": "cyberpunk",
  "author": "Nous Land",
  "version": "1.0.0",
  "colors": {
    "bg": "#0a0014",
    "bg_alt": "#120020",
    "bg_highlight": "#1a0030",
    "fg": "#e0d0ff",
    "fg_alt": "#b090dd",
    "fg_dim": "#6a4c8a",
    "accent": "#ff2e97",
    "accent_alt": "#ff6ec7",
    "urgent": "#ff0040",
    "success": "#00ff9f",
    "warning": "#ffb800",
    "border": "#2a0040",
    "shadow": "#000000"
  },
  "surface": {
    "panel_bg": "#0a0014",
    "panel_fg": "#e0d0ff",
    "panel_border": "#ff2e97",
    "launcher_bg": "#0a0014",
    "launcher_fg": "#e0d0ff",
    "launcher_sel_bg": "#ff2e97",
    "launcher_sel_fg": "#0a0014",
    "notification_bg": "#120020",
    "notification_fg": "#e0d0ff",
    "notification_border": "#00cfff"
  },
  "typography": {
    "font_mono": "JetBrainsMono Nerd Font",
    "font_ui": "JetBrainsMono Nerd Font",
    "font_size": 11,
    "font_size_ui": 9
  },
  "wallpaper": {
    "path": "wallpaper.png",
    "mode": "fill"
  },
  "hyprland": {
    "border_width": 2,
    "active_border": "ff2e97",
    "inactive_border": "2a0040",
    "gaps_inner": 5,
    "gaps_outer": 7,
    "rounding": 4,
    "dim_strength": 0.4,
    "shadow_range": 25,
    "shadow_render_power": 4
  },
  "kitty": {
    "foreground": "#e0d0ff",
    "background": "#0a0014",
    "selection_foreground": "#0a0014",
    "selection_background": "#ff2e97",
    "cursor": "#ff2e97",
    "cursor_text_color": "#0a0014",
    "url_color": "#00cfff",
    "active_border_color": "#ff2e97",
    "inactive_border_color": "#2a0040",
    "active_tab_background": "#ff2e97",
    "active_tab_foreground": "#0a0014",
    "inactive_tab_background": "#120020",
    "inactive_tab_foreground": "#6a4c8a",
    "color0": "#0a0014",
    "color1": "#ff0040",
    "color2": "#00ff9f",
    "color3": "#ffb800",
    "color4": "#00cfff",
    "color5": "#ff2e97",
    "color6": "#00ffcc",
    "color7": "#e0d0ff",
    "color8": "#6a4c8a",
    "color9": "#ff4060",
    "color10": "#40ffb0",
    "color11": "#ffc840",
    "color12": "#40d0ff",
    "color13": "#ff6ec7",
    "color14": "#40ffdd",
    "color15": "#ffffff"
  }
}
