{
  "name": "pharaoh",
  "author": "Nous Land",
  "version": "1.0.0",
  "colors": {
    "bg": "#0a0a0a",
    "bg_alt": "#141414",
    "bg_highlight": "#1e1e1e",
    "fg": "#d4c5a9",
    "fg_alt": "#b8a88a",
    "fg_dim": "#8a7e6a",
    "accent": "#d4a017",
    "accent_alt": "#f0c75e",
    "urgent": "#c0392b",
    "success": "#27ae60",
    "warning": "#e67e22",
    "border": "#2c2c2c",
    "shadow": "#000000"
  },
  "surface": {
    "panel_bg": "#0a0a0a",
    "panel_fg": "#d4c5a9",
    "panel_border": "#2c2c2c",
    "launcher_bg": "#0a0a0a",
    "launcher_fg": "#d4c5a9",
    "launcher_sel_bg": "#d4a017",
    "launcher_sel_fg": "#0a0a0a",
    "notification_bg": "#141414",
    "notification_fg": "#d4c5a9",
    "notification_border": "#d4a017"
  },
  "typography": {
    "font_mono": "JetBrainsMono Nerd Font",
    "font_ui": "JetBrainsMono Nerd Font",
    "font_size": 11,
    "font_size_ui": 9
  },
  "wallpaper": {
    "path": "wallpaper.png",
    "mode": "fill"
  },
  "hyprland": {
    "border_width": 2,
    "active_border": "d4a017",
    "inactive_border": "2c2c2c",
    "gaps_inner": 6,
    "gaps_outer": 8,
    "rounding": 8,
    "dim_strength": 0.3,
    "shadow_range": 20,
    "shadow_render_power": 3
  },
  "kitty": {
    "foreground": "#d4c5a9",
    "background": "#0a0a0a",
    "selection_foreground": "#0a0a0a",
    "selection_background": "#d4a017",
    "cursor": "#d4a017",
    "cursor_text_color": "#0a0a0a",
    "url_color": "#f0c75e",
    "active_border_color": "#d4a017",
    "inactive_border_color": "#2c2c2c",
    "active_tab_background": "#d4a017",
    "active_tab_foreground": "#0a0a0a",
    "inactive_tab_background": "#141414",
    "inactive_tab_foreground": "#8a7e6a",
    "color0": "#0a0a0a",
    "color1": "#c0392b",
    "color2": "#27ae60",
    "color3": "#d4a017",
    "color4": "#2980b9",
    "color5": "#8e44ad",
    "color6": "#1abc9c",
    "color7": "#d4c5a9",
    "color8": "#555555",
    "color9": "#e74c3c",
    "color10": "#2ecc71",
    "color11": "#f1c40f",
    "color12": "#3498db",
    "color13": "#9b59b6",
    "color14": "#16a085",
    "color15": "#ffffff"
  }
}
